{
  "property_id": "harris-2026-11-acct-1224500010028",
  "sale_id": "harris-2026-11-03",
  "county": "Harris",
  "address": "1279 W 17TH ST, HOUSTON, 77008",
  "account_no": "1224500010028",
  "cause_no": "202459393",
  "intake": {
    "scout_notes": {
      "value": "Precinct 1; tipo EOS; sale# 4; sentencia 12/02/2025; sin direccion publicada aun; sin apertura publicada aun; fuente https://www.hctax.net/Property/listings/taxsalelisting",
      "status": "verified",
      "source": "candidatos.csv (scout)",
      "retrieved_at": "2026-10-11"
    },
    "hcad_site_address": {
      "value": "1279 W 17TH ST, HOUSTON, 77008",
      "status": "verified",
      "source": "https://download.hcad.org/data/CAMA/2026/Real_acct_owner.zip#real_acct.txt",
      "retrieved_at": "2026-10-11"
    },
    "hcad_owner": {
      "value": "MORRISON DOUGLAS W JR (1.0000%)",
      "status": "verified",
      "source": "https://download.hcad.org/data/CAMA/2026/Real_acct_owner.zip#real_acct.txt",
      "retrieved_at": "2026-10-11"
    },
    "hcad_mailing_address": {
      "value": "1279 W 17TH ST, HOUSTON, TX, 77008-3439",
      "status": "verified",
      "source": "https://download.hcad.org/data/CAMA/2026/Real_acct_owner.zip#real_acct.txt",
      "retrieved_at": "2026-10-11"
    },
    "hcad_state_class": {
      "value": "A1",
      "status": "verified",
      "source": "https://download.hcad.org/data/CAMA/2026/Real_acct_owner.zip#real_acct.txt",
      "retrieved_at": "2026-10-11"
    },
    "hcad_land_sqft": {
      "value": "1472",
      "status": "verified",
      "source": "https://download.hcad.org/data/CAMA/2026/Real_acct_owner.zip#real_acct.txt",
      "retrieved_at": "2026-10-11"
    },
    "hcad_acres": {
      "value": "0.0338",
      "status": "verified",
      "source": "https://download.hcad.org/data/CAMA/2026/Real_acct_owner.zip#real_acct.txt",
      "retrieved_at": "2026-10-11"
    },
    "hcad_building_sqft": {
      "value": "1945",
      "status": "verified",
      "source": "https://download.hcad.org/data/CAMA/2026/Real_acct_owner.zip#real_acct.txt",
      "retrieved_at": "2026-10-11"
    },
    "hcad_year_improved": {
      "value": "2003",
      "status": "verified",
      "source": "https://download.hcad.org/data/CAMA/2026/Real_acct_owner.zip#real_acct.txt",
      "retrieved_at": "2026-10-11"
    },
    "hcad_land_value": {
      "value": "111283",
      "status": "verified",
      "source": "https://download.hcad.org/data/CAMA/2026/Real_acct_owner.zip#real_acct.txt",
      "retrieved_at": "2026-10-11"
    },
    "hcad_building_value": {
      "value": "230915",
      "status": "verified",
      "source": "https://download.hcad.org/data/CAMA/2026/Real_acct_owner.zip#real_acct.txt",
      "retrieved_at": "2026-10-11"
    },
    "hcad_market_value": {
      "value": "342198",
      "status": "verified",
      "source": "https://download.hcad.org/data/CAMA/2026/Real_acct_owner.zip#real_acct.txt",
      "retrieved_at": "2026-10-11"
    },
    "hcad_prior_market_value": {
      "value": "365327",
      "status": "verified",
      "source": "https://download.hcad.org/data/CAMA/2026/Real_acct_owner.zip#real_acct.txt",
      "retrieved_at": "2026-10-11"
    },
    "hcad_exemptions": {
      "value": "RES (Residential Homestead)",
      "status": "verified",
      "source": "https://download.hcad.org/data/CAMA/2026/Real_acct_owner.zip#real_acct.txt",
      "retrieved_at": "2026-10-11"
    },
    "hcad_homestead_on_roll": {
      "value": "yes",
      "status": "verified",
      "source": "https://download.hcad.org/data/CAMA/2026/Real_acct_owner.zip#real_acct.txt",
      "retrieved_at": "2026-10-11"
    },
    "hcad_land_detail": {
      "value": "Res Improved Table Value 1472.0000xSF $111283",
      "status": "verified",
      "source": "https://download.hcad.org/data/CAMA/2026/Real_acct_owner.zip#real_acct.txt",
      "retrieved_at": "2026-10-11"
    },
    "hcad_buildings": {
      "value": "Residential 2475sf built 2003",
      "status": "verified",
      "source": "https://download.hcad.org/data/CAMA/2026/Real_acct_owner.zip#real_acct.txt",
      "retrieved_at": "2026-10-11"
    },
    "hcad_deeds_recorded": {
      "value": "05/27/2004 2004-X696927 | 06/01/2022 2022-RP-2022-293786",
      "status": "verified",
      "source": "https://download.hcad.org/data/CAMA/2026/Real_acct_owner.zip#real_acct.txt",
      "retrieved_at": "2026-10-11"
    },
    "hcad_legal": {
      "value": "LT 28 BLK 1 WEST EIGHTEENTH STREET T/H",
      "status": "verified",
      "source": "https://download.hcad.org/data/CAMA/2026/Real_acct_owner.zip#real_acct.txt",
      "retrieved_at": "2026-10-11"
    },
    "hcad_owner_since": {
      "value": "06/01/2022",
      "status": "verified",
      "source": "https://download.hcad.org/data/CAMA/2026/Real_acct_owner.zip#real_acct.txt",
      "retrieved_at": "2026-10-11"
    }
  }
}
