{
  "property_id": "harris-2026-11-acct-1067580010002",
  "sale_id": "harris-2026-11-03",
  "county": "Harris",
  "address": "10272 LONGMONT DR 39/2, HOUSTON, 77042",
  "account_no": "1067580010002",
  "cause_no": "202530424*",
  "intake": {
    "scout_notes": {
      "value": "Precinct 5; tipo EOS; sale# 13; sentencia 06/02/2026; sin direccion publicada aun; sin apertura publicada aun; fuente https://www.hctax.net/Property/listings/taxsalelisting",
      "status": "verified",
      "source": "candidatos.csv (scout)",
      "retrieved_at": "2026-10-11"
    },
    "hcad_site_address": {
      "value": "10272 LONGMONT DR 39/2, HOUSTON, 77042",
      "status": "verified",
      "source": "https://download.hcad.org/data/CAMA/2026/Real_acct_owner.zip#real_acct.txt",
      "retrieved_at": "2026-10-11"
    },
    "hcad_owner": {
      "value": "GALVAN ALENA M (1.0000%)",
      "status": "verified",
      "source": "https://download.hcad.org/data/CAMA/2026/Real_acct_owner.zip#real_acct.txt",
      "retrieved_at": "2026-10-11"
    },
    "hcad_mailing_address": {
      "value": "4711 LJ PKWY APT 2102, SUGAR LAND, TX, 77479-4961",
      "status": "verified",
      "source": "https://download.hcad.org/data/CAMA/2026/Real_acct_owner.zip#real_acct.txt",
      "retrieved_at": "2026-10-11"
    },
    "hcad_state_class": {
      "value": "A1",
      "status": "verified",
      "source": "https://download.hcad.org/data/CAMA/2026/Real_acct_owner.zip#real_acct.txt",
      "retrieved_at": "2026-10-11"
    },
    "hcad_land_sqft": {
      "value": "0",
      "status": "verified",
      "source": "https://download.hcad.org/data/CAMA/2026/Real_acct_owner.zip#real_acct.txt",
      "retrieved_at": "2026-10-11"
    },
    "hcad_acres": {
      "value": "0.0000",
      "status": "verified",
      "source": "https://download.hcad.org/data/CAMA/2026/Real_acct_owner.zip#real_acct.txt",
      "retrieved_at": "2026-10-11"
    },
    "hcad_building_sqft": {
      "value": "1258",
      "status": "verified",
      "source": "https://download.hcad.org/data/CAMA/2026/Real_acct_owner.zip#real_acct.txt",
      "retrieved_at": "2026-10-11"
    },
    "hcad_year_improved": {
      "value": "1975",
      "status": "verified",
      "source": "https://download.hcad.org/data/CAMA/2026/Real_acct_owner.zip#real_acct.txt",
      "retrieved_at": "2026-10-11"
    },
    "hcad_land_value": {
      "value": "65000",
      "status": "verified",
      "source": "https://download.hcad.org/data/CAMA/2026/Real_acct_owner.zip#real_acct.txt",
      "retrieved_at": "2026-10-11"
    },
    "hcad_building_value": {
      "value": "147486",
      "status": "verified",
      "source": "https://download.hcad.org/data/CAMA/2026/Real_acct_owner.zip#real_acct.txt",
      "retrieved_at": "2026-10-11"
    },
    "hcad_market_value": {
      "value": "212486",
      "status": "verified",
      "source": "https://download.hcad.org/data/CAMA/2026/Real_acct_owner.zip#real_acct.txt",
      "retrieved_at": "2026-10-11"
    },
    "hcad_prior_market_value": {
      "value": "217986",
      "status": "verified",
      "source": "https://download.hcad.org/data/CAMA/2026/Real_acct_owner.zip#real_acct.txt",
      "retrieved_at": "2026-10-11"
    },
    "hcad_exemptions": {
      "value": "none on roll",
      "status": "verified",
      "source": "https://download.hcad.org/data/CAMA/2026/Real_acct_owner.zip#real_acct.txt",
      "retrieved_at": "2026-10-11"
    },
    "hcad_homestead_on_roll": {
      "value": "no",
      "status": "verified",
      "source": "https://download.hcad.org/data/CAMA/2026/Real_acct_owner.zip#real_acct.txt",
      "retrieved_at": "2026-10-11"
    },
    "hcad_land_detail": {
      "value": "Res Improved Table Value 1.0000xGR $65000",
      "status": "verified",
      "source": "https://download.hcad.org/data/CAMA/2026/Real_acct_owner.zip#real_acct.txt",
      "retrieved_at": "2026-10-11"
    },
    "hcad_buildings": {
      "value": "Residential 1258sf built 1975",
      "status": "verified",
      "source": "https://download.hcad.org/data/CAMA/2026/Real_acct_owner.zip#real_acct.txt",
      "retrieved_at": "2026-10-11"
    },
    "hcad_deeds_recorded": {
      "value": "02/22/2021 2021-RP-2021-90905 | 04/03/2007 2007-0205185 | 10/04/2013 2013-0513925",
      "status": "verified",
      "source": "https://download.hcad.org/data/CAMA/2026/Real_acct_owner.zip#real_acct.txt",
      "retrieved_at": "2026-10-11"
    },
    "hcad_legal": {
      "value": "UNIT 2 BLDG 39 TOWN & COUNTRY T/H SEC 2 R/P",
      "status": "verified",
      "source": "https://download.hcad.org/data/CAMA/2026/Real_acct_owner.zip#real_acct.txt",
      "retrieved_at": "2026-10-11"
    },
    "hcad_owner_since": {
      "value": "02/22/2021",
      "status": "verified",
      "source": "https://download.hcad.org/data/CAMA/2026/Real_acct_owner.zip#real_acct.txt",
      "retrieved_at": "2026-10-11"
    }
  }
}
