{
  "property_id": "harris-2026-11-acct-1245870010049",
  "sale_id": "harris-2026-11-03",
  "county": "Harris",
  "address": "9710 TUCKER CYPRESS DR, HOUSTON, 77095",
  "account_no": "1245870010049",
  "cause_no": "202363949",
  "intake": {
    "scout_notes": {
      "value": "Precinct 5; tipo PLURIES EOS; sale# 5; sentencia 08/04/2025; sin direccion publicada aun; sin apertura publicada aun; fuente https://www.hctax.net/Property/listings/taxsalelisting",
      "status": "verified",
      "source": "candidatos.csv (scout)",
      "retrieved_at": "2026-10-11"
    },
    "hcad_site_address": {
      "value": "9710 TUCKER CYPRESS DR, HOUSTON, 77095",
      "status": "verified",
      "source": "https://download.hcad.org/data/CAMA/2026/Real_acct_owner.zip#real_acct.txt",
      "retrieved_at": "2026-10-13"
    },
    "hcad_owner": {
      "value": "CURRENT OWNER (1.0000%); CURRENT OWNER (0.0000%)",
      "status": "verified",
      "source": "https://download.hcad.org/data/CAMA/2026/Real_acct_owner.zip#real_acct.txt",
      "retrieved_at": "2026-10-13"
    },
    "hcad_mailing_address": {
      "value": "9710 TUCKER CYPRESS DR, HOUSTON, TX, 77095-5058",
      "status": "verified",
      "source": "https://download.hcad.org/data/CAMA/2026/Real_acct_owner.zip#real_acct.txt",
      "retrieved_at": "2026-10-13"
    },
    "hcad_state_class": {
      "value": "A1",
      "status": "verified",
      "source": "https://download.hcad.org/data/CAMA/2026/Real_acct_owner.zip#real_acct.txt",
      "retrieved_at": "2026-10-13"
    },
    "hcad_land_sqft": {
      "value": "8681",
      "status": "verified",
      "source": "https://download.hcad.org/data/CAMA/2026/Real_acct_owner.zip#real_acct.txt",
      "retrieved_at": "2026-10-13"
    },
    "hcad_acres": {
      "value": "0.1993",
      "status": "verified",
      "source": "https://download.hcad.org/data/CAMA/2026/Real_acct_owner.zip#real_acct.txt",
      "retrieved_at": "2026-10-13"
    },
    "hcad_building_sqft": {
      "value": "2074",
      "status": "verified",
      "source": "https://download.hcad.org/data/CAMA/2026/Real_acct_owner.zip#real_acct.txt",
      "retrieved_at": "2026-10-13"
    },
    "hcad_year_improved": {
      "value": "2004",
      "status": "verified",
      "source": "https://download.hcad.org/data/CAMA/2026/Real_acct_owner.zip#real_acct.txt",
      "retrieved_at": "2026-10-13"
    },
    "hcad_land_value": {
      "value": "69443",
      "status": "verified",
      "source": "https://download.hcad.org/data/CAMA/2026/Real_acct_owner.zip#real_acct.txt",
      "retrieved_at": "2026-10-13"
    },
    "hcad_building_value": {
      "value": "241154",
      "status": "verified",
      "source": "https://download.hcad.org/data/CAMA/2026/Real_acct_owner.zip#real_acct.txt",
      "retrieved_at": "2026-10-13"
    },
    "hcad_market_value": {
      "value": "310597",
      "status": "verified",
      "source": "https://download.hcad.org/data/CAMA/2026/Real_acct_owner.zip#real_acct.txt",
      "retrieved_at": "2026-10-13"
    },
    "hcad_prior_market_value": {
      "value": "315007",
      "status": "verified",
      "source": "https://download.hcad.org/data/CAMA/2026/Real_acct_owner.zip#real_acct.txt",
      "retrieved_at": "2026-10-13"
    },
    "hcad_exemptions": {
      "value": "RES (Residential Homestead)",
      "status": "verified",
      "source": "https://download.hcad.org/data/CAMA/2026/Real_acct_owner.zip#real_acct.txt",
      "retrieved_at": "2026-10-13"
    },
    "hcad_homestead_on_roll": {
      "value": "yes",
      "status": "verified",
      "source": "https://download.hcad.org/data/CAMA/2026/Real_acct_owner.zip#real_acct.txt",
      "retrieved_at": "2026-10-13"
    },
    "hcad_land_detail": {
      "value": "Res Improved Table Value 6600.0000xSF $67320 | Res Improved Table Value 2081.0000xSF $2123",
      "status": "verified",
      "source": "https://download.hcad.org/data/CAMA/2026/Real_acct_owner.zip#real_acct.txt",
      "retrieved_at": "2026-10-13"
    },
    "hcad_buildings": {
      "value": "Residential 2625sf built 2004",
      "status": "verified",
      "source": "https://download.hcad.org/data/CAMA/2026/Real_acct_owner.zip#real_acct.txt",
      "retrieved_at": "2026-10-13"
    },
    "hcad_deeds_recorded": {
      "value": "05/18/2012 2012-0228374",
      "status": "verified",
      "source": "https://download.hcad.org/data/CAMA/2026/Real_acct_owner.zip#real_acct.txt",
      "retrieved_at": "2026-10-13"
    },
    "hcad_legal": {
      "value": "LT 49 BLK 1 CANYON LAKES AT STONEGATE SEC 6",
      "status": "verified",
      "source": "https://download.hcad.org/data/CAMA/2026/Real_acct_owner.zip#real_acct.txt",
      "retrieved_at": "2026-10-13"
    },
    "hcad_owner_since": {
      "value": "05/18/2012",
      "status": "verified",
      "source": "https://download.hcad.org/data/CAMA/2026/Real_acct_owner.zip#real_acct.txt",
      "retrieved_at": "2026-10-13"
    }
  }
}
