{
  "property_id": "harris-2026-08-1125-defender-st",
  "sale_id": "harris-2026-08-04",
  "county": "Harris",
  "address": "1125 Defender St, Houston TX 77029",
  "account_no": null,
  "cause_no": null,
  "intake": {
    "opening_bid": {
      "value": 10000.0,
      "status": "verified",
      "source": "candidatos.csv (scout)",
      "retrieved_at": "2026-10-07"
    },
    "scout_notes": {
      "value": "CALIBRACION venta 04/08/2026 (ya ocurrida); lote vacio 8400 sqft; cierre real $26500; valor tasador $67500; fuente: Harris_TaxDeed_Terrenos_Vendidos_2026 (PropertyOnion)",
      "status": "verified",
      "source": "candidatos.csv (scout)",
      "retrieved_at": "2026-10-07"
    }
  }
}
