{
  "property_id": "harris-2026-11-acct-0670340040023",
  "sale_id": "harris-2026-11-03",
  "county": "Harris",
  "address": "337 KILGORE AVE, BAYTOWN, 77520",
  "account_no": "0670340040023",
  "cause_no": "202509272",
  "intake": {
    "opening_bid": {
      "value": 409838.52,
      "status": "verified",
      "source": "candidatos.csv (scout)",
      "retrieved_at": "2026-10-11"
    },
    "scout_notes": {
      "value": "Precinct 3; tipo EOS; sale# 1; sentencia 05/07/2026; sin direccion publicada aun; fuente https://www.hctax.net/Property/listings/taxsalelisting",
      "status": "verified",
      "source": "candidatos.csv (scout)",
      "retrieved_at": "2026-10-11"
    },
    "hcad_site_address": {
      "value": "337 KILGORE AVE, BAYTOWN, 77520",
      "status": "verified",
      "source": "https://download.hcad.org/data/CAMA/2026/Real_acct_owner.zip#real_acct.txt",
      "retrieved_at": "2026-10-11"
    },
    "hcad_owner": {
      "value": "RYAN TONIA (1.0000%)",
      "status": "verified",
      "source": "https://download.hcad.org/data/CAMA/2026/Real_acct_owner.zip#real_acct.txt",
      "retrieved_at": "2026-10-11"
    },
    "hcad_mailing_address": {
      "value": "PO BOX 131, BAYTOWN, TX, 77522-0131",
      "status": "verified",
      "source": "https://download.hcad.org/data/CAMA/2026/Real_acct_owner.zip#real_acct.txt",
      "retrieved_at": "2026-10-11"
    },
    "hcad_state_class": {
      "value": "A1",
      "status": "verified",
      "source": "https://download.hcad.org/data/CAMA/2026/Real_acct_owner.zip#real_acct.txt",
      "retrieved_at": "2026-10-11"
    },
    "hcad_land_sqft": {
      "value": "90528",
      "status": "verified",
      "source": "https://download.hcad.org/data/CAMA/2026/Real_acct_owner.zip#real_acct.txt",
      "retrieved_at": "2026-10-11"
    },
    "hcad_acres": {
      "value": "2.0782",
      "status": "verified",
      "source": "https://download.hcad.org/data/CAMA/2026/Real_acct_owner.zip#real_acct.txt",
      "retrieved_at": "2026-10-11"
    },
    "hcad_building_sqft": {
      "value": "1926",
      "status": "verified",
      "source": "https://download.hcad.org/data/CAMA/2026/Real_acct_owner.zip#real_acct.txt",
      "retrieved_at": "2026-10-11"
    },
    "hcad_year_improved": {
      "value": "1957",
      "status": "verified",
      "source": "https://download.hcad.org/data/CAMA/2026/Real_acct_owner.zip#real_acct.txt",
      "retrieved_at": "2026-10-11"
    },
    "hcad_land_value": {
      "value": "135158",
      "status": "verified",
      "source": "https://download.hcad.org/data/CAMA/2026/Real_acct_owner.zip#real_acct.txt",
      "retrieved_at": "2026-10-11"
    },
    "hcad_building_value": {
      "value": "150873",
      "status": "verified",
      "source": "https://download.hcad.org/data/CAMA/2026/Real_acct_owner.zip#real_acct.txt",
      "retrieved_at": "2026-10-11"
    },
    "hcad_market_value": {
      "value": "304097",
      "status": "verified",
      "source": "https://download.hcad.org/data/CAMA/2026/Real_acct_owner.zip#real_acct.txt",
      "retrieved_at": "2026-10-11"
    },
    "hcad_prior_market_value": {
      "value": "304097",
      "status": "verified",
      "source": "https://download.hcad.org/data/CAMA/2026/Real_acct_owner.zip#real_acct.txt",
      "retrieved_at": "2026-10-11"
    },
    "hcad_exemptions": {
      "value": "none on roll",
      "status": "verified",
      "source": "https://download.hcad.org/data/CAMA/2026/Real_acct_owner.zip#real_acct.txt",
      "retrieved_at": "2026-10-11"
    },
    "hcad_homestead_on_roll": {
      "value": "no",
      "status": "verified",
      "source": "https://download.hcad.org/data/CAMA/2026/Real_acct_owner.zip#real_acct.txt",
      "retrieved_at": "2026-10-11"
    },
    "hcad_land_detail": {
      "value": "Res Improved Table Value 20000.0000xSF $60000 | Res Improved Table Value 20000.0000xSF $60000 | Res Improved Table Value 50528.0000xSF $15158",
      "status": "verified",
      "source": "https://download.hcad.org/data/CAMA/2026/Real_acct_owner.zip#real_acct.txt",
      "retrieved_at": "2026-10-11"
    },
    "hcad_buildings": {
      "value": "Residential 1926sf built 1957",
      "status": "verified",
      "source": "https://download.hcad.org/data/CAMA/2026/Real_acct_owner.zip#real_acct.txt",
      "retrieved_at": "2026-10-11"
    },
    "hcad_deeds_recorded": {
      "value": "06/10/2024 2024-RP-2024-232631 | 10/30/2020 2020-RP-2020-528125",
      "status": "verified",
      "source": "https://download.hcad.org/data/CAMA/2026/Real_acct_owner.zip#real_acct.txt",
      "retrieved_at": "2026-10-11"
    },
    "hcad_legal": {
      "value": "LTS 23 & 24 BLK 4 LAKEVIEW HEIGHTS",
      "status": "verified",
      "source": "https://download.hcad.org/data/CAMA/2026/Real_acct_owner.zip#real_acct.txt",
      "retrieved_at": "2026-10-11"
    },
    "hcad_owner_since": {
      "value": "06/10/2024",
      "status": "verified",
      "source": "https://download.hcad.org/data/CAMA/2026/Real_acct_owner.zip#real_acct.txt",
      "retrieved_at": "2026-10-11"
    }
  },
  "physical": {
    "fema_effective_zone": {
      "value": "X (AREA OF MINIMAL FLOOD HAZARD)",
      "status": "verified",
      "source": "FEMA NFHL MapServer layer 28 (hazards.fema.gov); geocode: US Census",
      "retrieved_at": "2026-10-11",
      "note": "Point = geocoded address (337 KILGORE AVE, BAYTOWN, TX, 77520), not parcel centroid; effective NFHL only, draft MAAPnext not checked; no depth grids."
    },
    "floodway": {
      "value": "no",
      "status": "verified",
      "source": "FEMA NFHL MapServer layer 28 (hazards.fema.gov); geocode: US Census",
      "retrieved_at": "2026-10-11",
      "note": "Point = geocoded address (337 KILGORE AVE, BAYTOWN, TX, 77520), not parcel centroid; effective NFHL only, draft MAAPnext not checked; no depth grids."
    },
    "fema_sfha": {
      "value": false,
      "status": "verified",
      "source": "FEMA NFHL MapServer layer 28 (hazards.fema.gov); geocode: US Census",
      "retrieved_at": "2026-10-11"
    }
  },
  "title": {
    "rp_hits_grantee": {
      "value": [
        "RP-2025-104452 | 03/24/2025 | L/P | Grantor: HAZEL WILLIAM J Grantee: RYAN TONIA OLA | Desc: LAKEVIEW HEIGHTS Lot: 23-24 Block: 4",
        "RP-2024-232631 | 06/26/2024 | W/D | Grantor: HAZEL WILLIAM J Grantee: RYAN TONIA | Desc: LAKEVIEW HEIGHTS Lot: 23-24 Block: 4"
      ],
      "status": "inferred",
      "source": "https://www.cclerk.hctx.net/Applications/WebSearch/RP.aspx (grantee/grantor name search 'RYAN TONIA')",
      "retrieved_at": "2026-10-11",
      "note": "Name search only; identity not confirmed (same-name risk); index only, no images; other spellings/entities not searched; verify with legal-description search."
    },
    "rp_hits_grantor": {
      "value": [
        "RP-2024-446332 | 12/02/2024 | FI STM | Grantor: HAZEL WILLIAM Grantor: RYAN TONIA Grantee: SUNNOVA TE MANAGEMENT LLC | Desc: LAKEVIEW HEIGHTS Lot: 23-24 Block: 4",
        "RP-2024-232630 | 06/26/2024 | D/T | Grantor: RYAN TONIA Grantee: HAZEL WILLIAM J Trustee: YOUNGBLOOD SCOTT | Desc: LAKEVIEW HEIGHTS Lot: 23-24 Block: 4"
      ],
      "status": "inferred",
      "source": "https://www.cclerk.hctx.net/Applications/WebSearch/RP.aspx (grantee/grantor name search 'RYAN TONIA')",
      "retrieved_at": "2026-10-11",
      "note": "Name search only; identity not confirmed (same-name risk); index only, no images; other spellings/entities not searched; verify with legal-description search."
    },
    "rp_type_counts": {
      "value": {
        "L/P": 1,
        "W/D": 1,
        "FI STM": 1,
        "D/T": 1
      },
      "status": "inferred",
      "source": "https://www.cclerk.hctx.net/Applications/WebSearch/RP.aspx (grantee/grantor name search 'RYAN TONIA')",
      "retrieved_at": "2026-10-11"
    },
    "rp_summary": {
      "value": "2 instruments as grantee, 2 as grantor (index, name 'RYAN TONIA')",
      "status": "inferred",
      "source": "https://www.cclerk.hctx.net/Applications/WebSearch/RP.aspx (grantee/grantor name search 'RYAN TONIA')",
      "retrieved_at": "2026-10-11",
      "note": "Name search only; identity not confirmed (same-name risk); index only, no images; other spellings/entities not searched; verify with legal-description search."
    }
  }
}
