{
  "property_id": "harris-2026-11-acct-1263550010005",
  "sale_id": "harris-2026-11-03",
  "county": "Harris",
  "address": "2737 FOSTER HILL DR KINGWOOD 77345",
  "account_no": "1263550010005",
  "cause_no": "202205595",
  "intake": {
    "opening_bid": {
      "value": 11336.21,
      "status": "verified",
      "source": "candidatos.csv (scout)",
      "retrieved_at": "2026-10-13"
    },
    "scout_notes": {
      "value": "Precinct 4; tipo SALE; sale# 4; sentencia 06/05/2024; fuente https://www.hctax.net/Property/listings/taxsalelisting",
      "status": "verified",
      "source": "candidatos.csv (scout)",
      "retrieved_at": "2026-10-13"
    },
    "hcad_site_address": {
      "value": "2737 FOSTER HILL DR, KINGWOOD, 77345",
      "status": "verified",
      "source": "https://download.hcad.org/data/CAMA/2026/Real_acct_owner.zip#real_acct.txt",
      "retrieved_at": "2026-10-13"
    },
    "hcad_owner": {
      "value": "CURRENT OWNER (1.0000%)",
      "status": "verified",
      "source": "https://download.hcad.org/data/CAMA/2026/Real_acct_owner.zip#real_acct.txt",
      "retrieved_at": "2026-10-13"
    },
    "hcad_mailing_address": {
      "value": "2737 FOSTER HILL DR, KINGWOOD, TX, 77345-2556",
      "status": "verified",
      "source": "https://download.hcad.org/data/CAMA/2026/Real_acct_owner.zip#real_acct.txt",
      "retrieved_at": "2026-10-13"
    },
    "hcad_state_class": {
      "value": "A1",
      "status": "verified",
      "source": "https://download.hcad.org/data/CAMA/2026/Real_acct_owner.zip#real_acct.txt",
      "retrieved_at": "2026-10-13"
    },
    "hcad_land_sqft": {
      "value": "5500",
      "status": "verified",
      "source": "https://download.hcad.org/data/CAMA/2026/Real_acct_owner.zip#real_acct.txt",
      "retrieved_at": "2026-10-13"
    },
    "hcad_acres": {
      "value": "0.1263",
      "status": "verified",
      "source": "https://download.hcad.org/data/CAMA/2026/Real_acct_owner.zip#real_acct.txt",
      "retrieved_at": "2026-10-13"
    },
    "hcad_building_sqft": {
      "value": "2104",
      "status": "verified",
      "source": "https://download.hcad.org/data/CAMA/2026/Real_acct_owner.zip#real_acct.txt",
      "retrieved_at": "2026-10-13"
    },
    "hcad_year_improved": {
      "value": "2006",
      "status": "verified",
      "source": "https://download.hcad.org/data/CAMA/2026/Real_acct_owner.zip#real_acct.txt",
      "retrieved_at": "2026-10-13"
    },
    "hcad_land_value": {
      "value": "57750",
      "status": "verified",
      "source": "https://download.hcad.org/data/CAMA/2026/Real_acct_owner.zip#real_acct.txt",
      "retrieved_at": "2026-10-13"
    },
    "hcad_building_value": {
      "value": "210913",
      "status": "verified",
      "source": "https://download.hcad.org/data/CAMA/2026/Real_acct_owner.zip#real_acct.txt",
      "retrieved_at": "2026-10-13"
    },
    "hcad_market_value": {
      "value": "268663",
      "status": "verified",
      "source": "https://download.hcad.org/data/CAMA/2026/Real_acct_owner.zip#real_acct.txt",
      "retrieved_at": "2026-10-13"
    },
    "hcad_prior_market_value": {
      "value": "275508",
      "status": "verified",
      "source": "https://download.hcad.org/data/CAMA/2026/Real_acct_owner.zip#real_acct.txt",
      "retrieved_at": "2026-10-13"
    },
    "hcad_exemptions": {
      "value": "RES (Residential Homestead)",
      "status": "verified",
      "source": "https://download.hcad.org/data/CAMA/2026/Real_acct_owner.zip#real_acct.txt",
      "retrieved_at": "2026-10-13"
    },
    "hcad_homestead_on_roll": {
      "value": "yes",
      "status": "verified",
      "source": "https://download.hcad.org/data/CAMA/2026/Real_acct_owner.zip#real_acct.txt",
      "retrieved_at": "2026-10-13"
    },
    "hcad_land_detail": {
      "value": "Res Improved Table Value 5500.0000xSF $57750",
      "status": "verified",
      "source": "https://download.hcad.org/data/CAMA/2026/Real_acct_owner.zip#real_acct.txt",
      "retrieved_at": "2026-10-13"
    },
    "hcad_buildings": {
      "value": "Residential 2682sf built 2006",
      "status": "verified",
      "source": "https://download.hcad.org/data/CAMA/2026/Real_acct_owner.zip#real_acct.txt",
      "retrieved_at": "2026-10-13"
    },
    "hcad_deeds_recorded": {
      "value": "07/25/2014 2014-0363883",
      "status": "verified",
      "source": "https://download.hcad.org/data/CAMA/2026/Real_acct_owner.zip#real_acct.txt",
      "retrieved_at": "2026-10-13"
    },
    "hcad_legal": {
      "value": "LT 5 BLK 1 WOODSPRING FOREST SEC 2",
      "status": "verified",
      "source": "https://download.hcad.org/data/CAMA/2026/Real_acct_owner.zip#real_acct.txt",
      "retrieved_at": "2026-10-13"
    },
    "hcad_owner_since": {
      "value": "07/25/2014",
      "status": "verified",
      "source": "https://download.hcad.org/data/CAMA/2026/Real_acct_owner.zip#real_acct.txt",
      "retrieved_at": "2026-10-13"
    }
  }
}
