{
  "property_id": "harris-2026-11-acct-1116090000072",
  "sale_id": "harris-2026-11-03",
  "county": "Harris",
  "address": "12819 CRYSTAL COVE DR, HOUSTON, 77044",
  "account_no": "1116090000072",
  "cause_no": "202450677",
  "intake": {
    "opening_bid": {
      "value": 12924.32,
      "status": "verified",
      "source": "candidatos.csv (scout)",
      "retrieved_at": "2026-10-11"
    },
    "scout_notes": {
      "value": "Precinct 3; tipo EOS; sale# 4; sentencia 03/24/2025; sin direccion publicada aun; fuente https://www.hctax.net/Property/listings/taxsalelisting",
      "status": "verified",
      "source": "candidatos.csv (scout)",
      "retrieved_at": "2026-10-11"
    },
    "hcad_site_address": {
      "value": "12819 CRYSTAL COVE DR, HOUSTON, 77044",
      "status": "verified",
      "source": "https://download.hcad.org/data/CAMA/2026/Real_acct_owner.zip#real_acct.txt",
      "retrieved_at": "2026-10-13"
    },
    "hcad_owner": {
      "value": "DELOACH CHRISTOPHER D (0.3334%); BALDWIN SHAWN (0.3333%); BALDWIN LASHONDA (0.3333%)",
      "status": "verified",
      "source": "https://download.hcad.org/data/CAMA/2026/Real_acct_owner.zip#real_acct.txt",
      "retrieved_at": "2026-10-13"
    },
    "hcad_mailing_address": {
      "value": "12819 CRYSTAL COVE DR, HOUSTON, TX, 77044-1516",
      "status": "verified",
      "source": "https://download.hcad.org/data/CAMA/2026/Real_acct_owner.zip#real_acct.txt",
      "retrieved_at": "2026-10-13"
    },
    "hcad_state_class": {
      "value": "A1",
      "status": "verified",
      "source": "https://download.hcad.org/data/CAMA/2026/Real_acct_owner.zip#real_acct.txt",
      "retrieved_at": "2026-10-13"
    },
    "hcad_land_sqft": {
      "value": "6600",
      "status": "verified",
      "source": "https://download.hcad.org/data/CAMA/2026/Real_acct_owner.zip#real_acct.txt",
      "retrieved_at": "2026-10-13"
    },
    "hcad_acres": {
      "value": "0.1515",
      "status": "verified",
      "source": "https://download.hcad.org/data/CAMA/2026/Real_acct_owner.zip#real_acct.txt",
      "retrieved_at": "2026-10-13"
    },
    "hcad_building_sqft": {
      "value": "1793",
      "status": "verified",
      "source": "https://download.hcad.org/data/CAMA/2026/Real_acct_owner.zip#real_acct.txt",
      "retrieved_at": "2026-10-13"
    },
    "hcad_year_improved": {
      "value": "1981",
      "status": "verified",
      "source": "https://download.hcad.org/data/CAMA/2026/Real_acct_owner.zip#real_acct.txt",
      "retrieved_at": "2026-10-13"
    },
    "hcad_land_value": {
      "value": "49920",
      "status": "verified",
      "source": "https://download.hcad.org/data/CAMA/2026/Real_acct_owner.zip#real_acct.txt",
      "retrieved_at": "2026-10-13"
    },
    "hcad_building_value": {
      "value": "142840",
      "status": "verified",
      "source": "https://download.hcad.org/data/CAMA/2026/Real_acct_owner.zip#real_acct.txt",
      "retrieved_at": "2026-10-13"
    },
    "hcad_market_value": {
      "value": "192760",
      "status": "verified",
      "source": "https://download.hcad.org/data/CAMA/2026/Real_acct_owner.zip#real_acct.txt",
      "retrieved_at": "2026-10-13"
    },
    "hcad_prior_market_value": {
      "value": "216897",
      "status": "verified",
      "source": "https://download.hcad.org/data/CAMA/2026/Real_acct_owner.zip#real_acct.txt",
      "retrieved_at": "2026-10-13"
    },
    "hcad_exemptions": {
      "value": "RES (Residential Homestead)",
      "status": "verified",
      "source": "https://download.hcad.org/data/CAMA/2026/Real_acct_owner.zip#real_acct.txt",
      "retrieved_at": "2026-10-13"
    },
    "hcad_homestead_on_roll": {
      "value": "yes",
      "status": "verified",
      "source": "https://download.hcad.org/data/CAMA/2026/Real_acct_owner.zip#real_acct.txt",
      "retrieved_at": "2026-10-13"
    },
    "hcad_land_detail": {
      "value": "Res Improved Table Value 6200.0000xSF $49600 | Res Improved Table Value 400.0000xSF $320",
      "status": "verified",
      "source": "https://download.hcad.org/data/CAMA/2026/Real_acct_owner.zip#real_acct.txt",
      "retrieved_at": "2026-10-13"
    },
    "hcad_buildings": {
      "value": "Residential 2030sf built 1981",
      "status": "verified",
      "source": "https://download.hcad.org/data/CAMA/2026/Real_acct_owner.zip#real_acct.txt",
      "retrieved_at": "2026-10-13"
    },
    "hcad_deeds_recorded": {
      "value": "",
      "status": "verified",
      "source": "https://download.hcad.org/data/CAMA/2026/Real_acct_owner.zip#real_acct.txt",
      "retrieved_at": "2026-10-13"
    },
    "hcad_legal": {
      "value": "LT 72 BLK 2 PARKWAY FOREST SEC 4",
      "status": "verified",
      "source": "https://download.hcad.org/data/CAMA/2026/Real_acct_owner.zip#real_acct.txt",
      "retrieved_at": "2026-10-13"
    },
    "hcad_owner_since": {
      "value": "02/01/2017",
      "status": "verified",
      "source": "https://download.hcad.org/data/CAMA/2026/Real_acct_owner.zip#real_acct.txt",
      "retrieved_at": "2026-10-13"
    }
  }
}
