{
  "property_id": "harris-2026-11-acct-0162640600015",
  "sale_id": "harris-2026-11-03",
  "county": "Harris",
  "address": "7738 JAMES FRANKLIN ST. HOUSTON 77088",
  "account_no": "0162640600015",
  "cause_no": "202432973",
  "intake": {
    "opening_bid": {
      "value": 15416.13,
      "status": "verified",
      "source": "candidatos.csv (scout)",
      "retrieved_at": "2026-10-13"
    },
    "scout_notes": {
      "value": "Precinct 1; tipo SALE; sale# 7; sentencia 09/04/2025; fuente https://www.hctax.net/Property/listings/taxsalelisting",
      "status": "verified",
      "source": "candidatos.csv (scout)",
      "retrieved_at": "2026-10-13"
    },
    "hcad_site_address": {
      "value": "7738 JAMES FRANKLIN ST, HOUSTON, 77088",
      "status": "verified",
      "source": "https://download.hcad.org/data/CAMA/2026/Real_acct_owner.zip#real_acct.txt",
      "retrieved_at": "2026-10-13"
    },
    "hcad_owner": {
      "value": "JACKSON OCTAVIA JONES (1.0000%)",
      "status": "verified",
      "source": "https://download.hcad.org/data/CAMA/2026/Real_acct_owner.zip#real_acct.txt",
      "retrieved_at": "2026-10-13"
    },
    "hcad_mailing_address": {
      "value": "7738 JAMES FRANKLIN ST, HOUSTON, TX, 77088-6033",
      "status": "verified",
      "source": "https://download.hcad.org/data/CAMA/2026/Real_acct_owner.zip#real_acct.txt",
      "retrieved_at": "2026-10-13"
    },
    "hcad_state_class": {
      "value": "A1",
      "status": "verified",
      "source": "https://download.hcad.org/data/CAMA/2026/Real_acct_owner.zip#real_acct.txt",
      "retrieved_at": "2026-10-13"
    },
    "hcad_land_sqft": {
      "value": "6750",
      "status": "verified",
      "source": "https://download.hcad.org/data/CAMA/2026/Real_acct_owner.zip#real_acct.txt",
      "retrieved_at": "2026-10-13"
    },
    "hcad_acres": {
      "value": "0.1550",
      "status": "verified",
      "source": "https://download.hcad.org/data/CAMA/2026/Real_acct_owner.zip#real_acct.txt",
      "retrieved_at": "2026-10-13"
    },
    "hcad_building_sqft": {
      "value": "810",
      "status": "verified",
      "source": "https://download.hcad.org/data/CAMA/2026/Real_acct_owner.zip#real_acct.txt",
      "retrieved_at": "2026-10-13"
    },
    "hcad_year_improved": {
      "value": "1950",
      "status": "verified",
      "source": "https://download.hcad.org/data/CAMA/2026/Real_acct_owner.zip#real_acct.txt",
      "retrieved_at": "2026-10-13"
    },
    "hcad_land_value": {
      "value": "81692",
      "status": "verified",
      "source": "https://download.hcad.org/data/CAMA/2026/Real_acct_owner.zip#real_acct.txt",
      "retrieved_at": "2026-10-13"
    },
    "hcad_building_value": {
      "value": "35596",
      "status": "verified",
      "source": "https://download.hcad.org/data/CAMA/2026/Real_acct_owner.zip#real_acct.txt",
      "retrieved_at": "2026-10-13"
    },
    "hcad_market_value": {
      "value": "120957",
      "status": "verified",
      "source": "https://download.hcad.org/data/CAMA/2026/Real_acct_owner.zip#real_acct.txt",
      "retrieved_at": "2026-10-13"
    },
    "hcad_prior_market_value": {
      "value": "112104",
      "status": "verified",
      "source": "https://download.hcad.org/data/CAMA/2026/Real_acct_owner.zip#real_acct.txt",
      "retrieved_at": "2026-10-13"
    },
    "hcad_exemptions": {
      "value": "RES (Residential Homestead)",
      "status": "verified",
      "source": "https://download.hcad.org/data/CAMA/2026/Real_acct_owner.zip#real_acct.txt",
      "retrieved_at": "2026-10-13"
    },
    "hcad_homestead_on_roll": {
      "value": "yes",
      "status": "verified",
      "source": "https://download.hcad.org/data/CAMA/2026/Real_acct_owner.zip#real_acct.txt",
      "retrieved_at": "2026-10-13"
    },
    "hcad_land_detail": {
      "value": "Res Improved Table Value 6750.0000xSF $81692",
      "status": "verified",
      "source": "https://download.hcad.org/data/CAMA/2026/Real_acct_owner.zip#real_acct.txt",
      "retrieved_at": "2026-10-13"
    },
    "hcad_buildings": {
      "value": "Residential 890sf built 1950",
      "status": "verified",
      "source": "https://download.hcad.org/data/CAMA/2026/Real_acct_owner.zip#real_acct.txt",
      "retrieved_at": "2026-10-13"
    },
    "hcad_deeds_recorded": {
      "value": "02/13/2019 2019-RP-2019-65086 | 05/18/2005 2005-Y512599 | 08/07/2007 2007-0495554",
      "status": "verified",
      "source": "https://download.hcad.org/data/CAMA/2026/Real_acct_owner.zip#real_acct.txt",
      "retrieved_at": "2026-10-13"
    },
    "hcad_legal": {
      "value": "TR 15 OF LT 61 BLK 2 HIGHLAND ACRE HOMES",
      "status": "verified",
      "source": "https://download.hcad.org/data/CAMA/2026/Real_acct_owner.zip#real_acct.txt",
      "retrieved_at": "2026-10-13"
    },
    "hcad_owner_since": {
      "value": "02/13/2019",
      "status": "verified",
      "source": "https://download.hcad.org/data/CAMA/2026/Real_acct_owner.zip#real_acct.txt",
      "retrieved_at": "2026-10-13"
    }
  }
}
