{
  "property_id": "harris-2026-11-acct-0340640250007",
  "sale_id": "harris-2026-11-03",
  "county": "Harris",
  "address": "714 MISSOURI ST SOUTH HOUSTON 77587",
  "account_no": "0340640250007",
  "cause_no": "202382807",
  "intake": {
    "opening_bid": {
      "value": 174434.32,
      "status": "verified",
      "source": "candidatos.csv (scout)",
      "retrieved_at": "2026-10-13"
    },
    "scout_notes": {
      "value": "Precinct 2; tipo SALE; sale# 8; sentencia 06/13/2025; fuente https://www.hctax.net/Property/listings/taxsalelisting",
      "status": "verified",
      "source": "candidatos.csv (scout)",
      "retrieved_at": "2026-10-13"
    },
    "hcad_site_address": {
      "value": "714 MISSOURI ST, SOUTH HOUSTON, 77587",
      "status": "verified",
      "source": "https://download.hcad.org/data/CAMA/2026/Real_acct_owner.zip#real_acct.txt",
      "retrieved_at": "2026-10-13"
    },
    "hcad_owner": {
      "value": "RAMIREZ VALERIE & MARIO (1.0000%)",
      "status": "verified",
      "source": "https://download.hcad.org/data/CAMA/2026/Real_acct_owner.zip#real_acct.txt",
      "retrieved_at": "2026-10-13"
    },
    "hcad_mailing_address": {
      "value": "714 MISSOURI ST, SOUTH HOUSTON, TX, 77587-4525",
      "status": "verified",
      "source": "https://download.hcad.org/data/CAMA/2026/Real_acct_owner.zip#real_acct.txt",
      "retrieved_at": "2026-10-13"
    },
    "hcad_state_class": {
      "value": "A1",
      "status": "verified",
      "source": "https://download.hcad.org/data/CAMA/2026/Real_acct_owner.zip#real_acct.txt",
      "retrieved_at": "2026-10-13"
    },
    "hcad_land_sqft": {
      "value": "14200",
      "status": "verified",
      "source": "https://download.hcad.org/data/CAMA/2026/Real_acct_owner.zip#real_acct.txt",
      "retrieved_at": "2026-10-13"
    },
    "hcad_acres": {
      "value": "0.3261",
      "status": "verified",
      "source": "https://download.hcad.org/data/CAMA/2026/Real_acct_owner.zip#real_acct.txt",
      "retrieved_at": "2026-10-13"
    },
    "hcad_building_sqft": {
      "value": "1824",
      "status": "verified",
      "source": "https://download.hcad.org/data/CAMA/2026/Real_acct_owner.zip#real_acct.txt",
      "retrieved_at": "2026-10-13"
    },
    "hcad_year_improved": {
      "value": "1965",
      "status": "verified",
      "source": "https://download.hcad.org/data/CAMA/2026/Real_acct_owner.zip#real_acct.txt",
      "retrieved_at": "2026-10-13"
    },
    "hcad_land_value": {
      "value": "176410",
      "status": "verified",
      "source": "https://download.hcad.org/data/CAMA/2026/Real_acct_owner.zip#real_acct.txt",
      "retrieved_at": "2026-10-13"
    },
    "hcad_building_value": {
      "value": "116333",
      "status": "verified",
      "source": "https://download.hcad.org/data/CAMA/2026/Real_acct_owner.zip#real_acct.txt",
      "retrieved_at": "2026-10-13"
    },
    "hcad_market_value": {
      "value": "300764",
      "status": "verified",
      "source": "https://download.hcad.org/data/CAMA/2026/Real_acct_owner.zip#real_acct.txt",
      "retrieved_at": "2026-10-13"
    },
    "hcad_prior_market_value": {
      "value": "295858",
      "status": "verified",
      "source": "https://download.hcad.org/data/CAMA/2026/Real_acct_owner.zip#real_acct.txt",
      "retrieved_at": "2026-10-13"
    },
    "hcad_exemptions": {
      "value": "RES (Residential Homestead)",
      "status": "verified",
      "source": "https://download.hcad.org/data/CAMA/2026/Real_acct_owner.zip#real_acct.txt",
      "retrieved_at": "2026-10-13"
    },
    "hcad_homestead_on_roll": {
      "value": "yes",
      "status": "verified",
      "source": "https://download.hcad.org/data/CAMA/2026/Real_acct_owner.zip#real_acct.txt",
      "retrieved_at": "2026-10-13"
    },
    "hcad_land_detail": {
      "value": "Res Improved Table Value 6750.0000xSF $87750 | Res Improved Table Value 6750.0000xSF $87750 | Res Improved Table Value 700.0000xSF $910",
      "status": "verified",
      "source": "https://download.hcad.org/data/CAMA/2026/Real_acct_owner.zip#real_acct.txt",
      "retrieved_at": "2026-10-13"
    },
    "hcad_buildings": {
      "value": "Residential 2521sf built 1965",
      "status": "verified",
      "source": "https://download.hcad.org/data/CAMA/2026/Real_acct_owner.zip#real_acct.txt",
      "retrieved_at": "2026-10-13"
    },
    "hcad_deeds_recorded": {
      "value": "07/27/2022 2022-RP-2022-391139 | 11/27/2011 2022-RP-2022-391116",
      "status": "verified",
      "source": "https://download.hcad.org/data/CAMA/2026/Real_acct_owner.zip#real_acct.txt",
      "retrieved_at": "2026-10-13"
    },
    "hcad_legal": {
      "value": "LTS 7 & 8 BLK 125 SOUTH HOUSTON",
      "status": "verified",
      "source": "https://download.hcad.org/data/CAMA/2026/Real_acct_owner.zip#real_acct.txt",
      "retrieved_at": "2026-10-13"
    },
    "hcad_owner_since": {
      "value": "07/27/2022",
      "status": "verified",
      "source": "https://download.hcad.org/data/CAMA/2026/Real_acct_owner.zip#real_acct.txt",
      "retrieved_at": "2026-10-13"
    }
  }
}
