{
  "property_id": "harris-2026-11-acct-1032800000025",
  "sale_id": "harris-2026-11-03",
  "county": "Harris",
  "address": "9306 GUYWOOD ST, HOUSTON, 77040",
  "account_no": "1032800000025",
  "cause_no": "202525485",
  "intake": {
    "scout_notes": {
      "value": "Precinct 1; tipo EOS; sale# 3; sentencia 10/01/2025; sin direccion publicada aun; sin apertura publicada aun; fuente https://www.hctax.net/Property/listings/taxsalelisting",
      "status": "verified",
      "source": "candidatos.csv (scout)",
      "retrieved_at": "2026-10-11"
    },
    "hcad_site_address": {
      "value": "9306 GUYWOOD ST, HOUSTON, 77040",
      "status": "verified",
      "source": "https://download.hcad.org/data/CAMA/2026/Real_acct_owner.zip#real_acct.txt",
      "retrieved_at": "2026-10-11"
    },
    "hcad_owner": {
      "value": "MORENO DEMETRIO (1.0000%)",
      "status": "verified",
      "source": "https://download.hcad.org/data/CAMA/2026/Real_acct_owner.zip#real_acct.txt",
      "retrieved_at": "2026-10-11"
    },
    "hcad_mailing_address": {
      "value": "9306 GUYWOOD ST, HOUSTON, TX, 77040-4545",
      "status": "verified",
      "source": "https://download.hcad.org/data/CAMA/2026/Real_acct_owner.zip#real_acct.txt",
      "retrieved_at": "2026-10-11"
    },
    "hcad_state_class": {
      "value": "A1",
      "status": "verified",
      "source": "https://download.hcad.org/data/CAMA/2026/Real_acct_owner.zip#real_acct.txt",
      "retrieved_at": "2026-10-11"
    },
    "hcad_land_sqft": {
      "value": "6845",
      "status": "verified",
      "source": "https://download.hcad.org/data/CAMA/2026/Real_acct_owner.zip#real_acct.txt",
      "retrieved_at": "2026-10-11"
    },
    "hcad_acres": {
      "value": "0.1571",
      "status": "verified",
      "source": "https://download.hcad.org/data/CAMA/2026/Real_acct_owner.zip#real_acct.txt",
      "retrieved_at": "2026-10-11"
    },
    "hcad_building_sqft": {
      "value": "1003",
      "status": "verified",
      "source": "https://download.hcad.org/data/CAMA/2026/Real_acct_owner.zip#real_acct.txt",
      "retrieved_at": "2026-10-11"
    },
    "hcad_year_improved": {
      "value": "1971",
      "status": "verified",
      "source": "https://download.hcad.org/data/CAMA/2026/Real_acct_owner.zip#real_acct.txt",
      "retrieved_at": "2026-10-11"
    },
    "hcad_land_value": {
      "value": "37561",
      "status": "verified",
      "source": "https://download.hcad.org/data/CAMA/2026/Real_acct_owner.zip#real_acct.txt",
      "retrieved_at": "2026-10-11"
    },
    "hcad_building_value": {
      "value": "167242",
      "status": "verified",
      "source": "https://download.hcad.org/data/CAMA/2026/Real_acct_owner.zip#real_acct.txt",
      "retrieved_at": "2026-10-11"
    },
    "hcad_market_value": {
      "value": "205513",
      "status": "verified",
      "source": "https://download.hcad.org/data/CAMA/2026/Real_acct_owner.zip#real_acct.txt",
      "retrieved_at": "2026-10-11"
    },
    "hcad_prior_market_value": {
      "value": "219119",
      "status": "verified",
      "source": "https://download.hcad.org/data/CAMA/2026/Real_acct_owner.zip#real_acct.txt",
      "retrieved_at": "2026-10-11"
    },
    "hcad_exemptions": {
      "value": "RES (Residential Homestead)",
      "status": "verified",
      "source": "https://download.hcad.org/data/CAMA/2026/Real_acct_owner.zip#real_acct.txt",
      "retrieved_at": "2026-10-11"
    },
    "hcad_homestead_on_roll": {
      "value": "yes",
      "status": "verified",
      "source": "https://download.hcad.org/data/CAMA/2026/Real_acct_owner.zip#real_acct.txt",
      "retrieved_at": "2026-10-11"
    },
    "hcad_land_detail": {
      "value": "Res Improved Table Value 6600.0000xSF $37422 | Res Improved Table Value 245.0000xSF $139",
      "status": "verified",
      "source": "https://download.hcad.org/data/CAMA/2026/Real_acct_owner.zip#real_acct.txt",
      "retrieved_at": "2026-10-11"
    },
    "hcad_buildings": {
      "value": "Residential 1522sf built 1971",
      "status": "verified",
      "source": "https://download.hcad.org/data/CAMA/2026/Real_acct_owner.zip#real_acct.txt",
      "retrieved_at": "2026-10-11"
    },
    "hcad_deeds_recorded": {
      "value": "",
      "status": "verified",
      "source": "https://download.hcad.org/data/CAMA/2026/Real_acct_owner.zip#real_acct.txt",
      "retrieved_at": "2026-10-11"
    },
    "hcad_legal": {
      "value": "LT 25 BLK 1 WOODLAND TRAILS NORTH SEC 1",
      "status": "verified",
      "source": "https://download.hcad.org/data/CAMA/2026/Real_acct_owner.zip#real_acct.txt",
      "retrieved_at": "2026-10-11"
    },
    "hcad_owner_since": {
      "value": "02/03/1994",
      "status": "verified",
      "source": "https://download.hcad.org/data/CAMA/2026/Real_acct_owner.zip#real_acct.txt",
      "retrieved_at": "2026-10-11"
    }
  }
}
