{
  "property_id": "harris-2026-08-0-texas-st",
  "sale_id": "harris-2026-08-04",
  "county": "Harris",
  "address": "0 Texas St, Tomball TX 77375",
  "account_no": null,
  "cause_no": null,
  "intake": {
    "opening_bid": {
      "value": 21180.0,
      "status": "verified",
      "source": "candidatos.csv (scout)",
      "retrieved_at": "2026-10-07"
    },
    "scout_notes": {
      "value": "CALIBRACION venta 04/08/2026 (ya ocurrida); lote vacio 3500 sqft; cierre real $25000; valor tasador $51188; fuente: Harris_TaxDeed_Terrenos_Vendidos_2026 (PropertyOnion)",
      "status": "verified",
      "source": "candidatos.csv (scout)",
      "retrieved_at": "2026-10-07"
    }
  }
}
